{
  "schema_version": 1,
  "dataset_manifest": "runs/dataset/20260821T171339.642203000Z-e7071e84d64f/dataset-manifest.json",
  "models": {
    "prior": {
      "enabled": true
    },
    "logistic_regression": {
      "c_values": [0.01, 0.1, 1.0, 10.0],
      "penalty": "l2",
      "solver": "lbfgs",
      "max_iter": 2000
    },
    "hist_gradient_boosting": {
      "learning_rates": [0.05, 0.1],
      "max_leaf_nodes": [15, 31],
      "l2_regularization": [0.0, 1.0],
      "max_iter": 100
    }
  },
  "preprocessing": {
    "continuous_imputation": "median",
    "standardise_logistic": true,
    "standardise_hist_gradient_boosting": false,
    "unknown_symbol": "all_zero"
  },
  "selection_metric": "multiclass_log_loss",
  "seed": 7987
}
